artist_name,song_title,lyrics
Russell Dickerson,MGNO by Russell Dickerson,"
'Bout to take you out tonight baby
Let's go

Ni igh igh igh ight
This is your ni igh igh igh ight
It's been a long week
I know what you need, a little you and me
Yeah this is your ni igh igh igh ight
Oh woah woah woah woah
Yeah, we bout to go woah woah woah woah
We gonna shake it off and leave it all right out
There in the middle of the flo oh oh oh oor
That's right, come on

Hey, bring it over here little mama
Yeah, I got a whiskey waiting on ya
Hey, baby girl I'm gonna, do whatever you wanna
All night long

Gonna take you downtown, and we're gonna go all out
Gonna tear the moon down, woah oh oh oh
Gonna spin you right around
Anything you want now, because tonight is my
My girl's night out, my girl's night out

Oooh, 'bout to let loose
We gonna bust a move in these dirty boots
Yeah, baby that's what we're gonna dooo
That's right, come on

Hey, bring it over here little mama
Got another whiskey waiting on ya
Hey, baby girl I'm gonna, do whatever you wanna
All night long

Gonna take you downtown, and we're gonna go all out
Gonna tear the moon down, woah oh oh oh
Gonna spin you right around
Anything you want now, because tonight is my
My girl's night out, my girl's night out
Ni igh igh igh ight
This is your ni igh igh igh ight

Gonna take you downtown, and we're gonna go all out
Gonna tear that moon down, woah oh oh oh
Gonna spin you right around
Anything you want now, because tonight is my
My girl's night out, my girl's night out

Woo!
Woo!
Hey, hey
Yeah, go go go go go go go go
Gonna get down like it's your birthday"
Russell Dickerson,Yours (Wedding Edition) by Russell Dickerson,"
I was a boat stuck in a bottle
That never got the chance to touch the sea
Just forgot on the shelf
No wind in the sails
Going nowhere with no one but me
I was one in a hundred billion
A burned out star in a galaxy
Just lost in the sky wondering why
Everyone else shines out but me

But I came to life when I first kissed you
The best me has his arms around you
You make me better than I was before
Thank God I'm yours

I was a worn out set of shoes
Wandering the city street
Another face in the crowd
Head looking down
Lost in the sound of a lonely melody
Empty pockets at a roulette
Always landing on a lost bet
Just live for the spin and hope for the win
Go all in just to lose again

But I came to life when I first kissed you
The best me has his arms around you
You make me better than I was before
Thank God I'm yours
The worst me is just a long gone memory
You put a new heartbeat inside of me
You make me better than I was before
Thank God I'm yours, oh

I was a boat stuck in a bottle
That never got the chance to touch the sea

I came to life when I first kissed you
The best me has his arms around you
You make me better than I was before
Thank God I'm yours
The worst me is just a long gone memory
You put a new heartbeat inside of me
You make me better than I was before
Thank God I'm yours
Thank God I'm yours
Thank God I'm yours, oh
Thank God I'm yours"
Russell Dickerson,Billions by Russell Dickerson,"
Oh yeah, oh yeah

If lovin' was money, how much you think we'd make
If kisses were cash, we'd never stop making it rain, no
The way that I picture it our pockets thicker than Bill Gates
If lovin' was money, we'd make it all the way to the bank

Rakin' it in by the billions
Cash stacked up to the ceiling
Livin' on champagne and chocolate, somewhere exotic
Kissin' on a beach, alone, 'cause we bought it
Talking gazillions, top o' Fortune 500 chillin', yeah
Girl if loving was dollars, you know we'd be ballers
Rakin' it in by the billions
Oh yeah

If lovin' was money, then we'd never clock out of work, nah
Girl, we'd stay extra hours, after all the lights have been turned off
Oh if all my attention was Benjamins, you'd have 'em all to burn
If lovin' was money, there's no telling what we'd be worth

Rakin' it in by the billions
Cash stacked up to the ceiling
Livin' on champagne and chocolate, somewhere exotic
Kissin' on a beach, alone, cause we bought it
Talking gazillions, top o' Fortune 500 chillin', yeah
Girl if loving was dollars, you know we'd be ballers
Rakin' it in by the billions
Oh yeah

Make a little love, make a little money
Make a little love, make a little money
Make a whole lotta love and a whole lotta money, oh

Rakin' it in by the billions
Cash stacked up to the ceiling
Livin' on champagne and chocolate somewhere exotic
Kissin' on a beach, alone, cause we bought it
Talking gazillions, top o' Fortune 500 chillin', yeah
Girl if loving was dollars, you know we'd be ballers
Rakin' it in by the billions
Oh yeah
Just rakin' it in by the billions
Oh yeah, girl
If besos were pesos, no telling how much we'd make girl
You know we rakin' it in, rakin' it in, rakin' it in, yeah
Rakin' it in by the billions"
Morgan Wallen,Don't Think Jesus by Morgan Wallen,"
A boy gets a guitar and starts writing songs
About whiskey and women and getting too stoned
He got all three at the first show he played
Hometown said, ""I don't think Jesus done it that way""
Boy moves to city lives fast and goes hard
Starts chasing the devil through honky-tonk bars
Ignoring the voices in his head that say, ""I don't think Jesus done it this way""

If I was Him I'd say, ""To hell with you, ain't no helping you”
Find someone else to give Heaven to, I'm telling you
I'd shame me, I'd blame me
I'd make me pay for my mistakes
Oh, but I don't think Jesus does it that way

Boy's all alone, got no one to turn to
He figures he'll pray 'cause what else could he do?
He said, ""I wish You would've woke me up an easier way""
But I don't think Jesus does it that way

If I was Him I'd say,
""To hell with you, ain't no helping you”
Find someone else to give Heaven to, I'm telling you
I'd shame me, I'd blame me
I'd make me pay for my mistakes
But I don't think Jesus does it that way

World likes to rear back and throw a few stones
So boy wants to throw a few stones of his own
But Lord knows I ain't perfect, and it ain't my place
And I don't think Jesus done it that way
Are y'all sure that Jesus done it that way?"
Morgan Wallen,7 Summers by Morgan Wallen,"
Yeah, you used to talk about
Getting even further South
Somewhere where the summer lasted all year 'round
Probably got a big ol' diamond on your hand right now
Maybe a baby or a couple by now
Long driveway to a big white house

But I wonder when you're drinking if you
Find yourself thinking about
That boy from East Tennessee
And I know we both knew better
But we still said forever
And that was seven summers
Of Coke and Southern Comfort
Were we dumb or just younger, who knows?
Back then, you used to love the river
And sippin' on a sixer with me
Does it ever make you sad to know
That was seven summers ago?

Ooh, ooh-ooh, ooh-ooh

Yeah, I bet your daddy's so proud
Of how his little girl turned out
Think she dodged a bullet
Of a good old boy like me
'Cause I still
Go drinkin', same friends on Friday
Bought a few acres, couple roads off the highway
Guess you never saw things my way anyway

But I wonder when you're drinking if you
Find yourself thinking about
That boy from East Tennessee
And I know we both knew better
But we still said forever
And that was seven summers
Of Coke and Southern Comfort
Were we dumb or just younger, who knows?
Back then, you used to love the river
And sippin' on a sixer with me
Does it ever make you sad to know
That was seven summers ago?
Ooh
Seven summers ago 
Seven summers ago 

Yeah, I wonder when you're drinking if you
Find yourself thinking about
That boy from East Tennessee
And I know we both knew better
But we still said forever
And that was seven summers
Of Coke and Southern Comfort
Were we dumb or just younger, who knows?
Back then, you used to love the river
And sippin' on a sixer with me
Does it ever make you sad to know
That was seven summers ago?

Ooh
Seven summers ago 
Seven summers ago "
Morgan Wallen,Somebody's Problem by Morgan Wallen,"
A 'Bama red 4Runner pulled into the party
With a 30-A sticker on the back windshield
Two-tone tank top slippin' off her shoulder
Kinda girl when she steps out, the world stands still

Ooh, I know where this is goin'
I already know it

She's somebody's problem, somebody's goodbye
Somebody's last call number that they can't find
Somebody's best day, somebody's worst night
Somebody's reason for leavin' on the porch light
Thinkin' 'bout them tan lines and I'm thinkin' damn, I'd
Love to drown in them heartbreaker blue eyes
Shе's somebody's problem and somebody's problеm's
About to be mine
About to be mine

Kinda girl once you've had her, you can't stand to lose her
Kinda girl where your friends tell you don't F it up
Kinda girl that goes from tryin' to just to get her number
To slidin' through the summer to talkin' 'bout love

Ooh, I think I'm likin' where it's goin'
I'd like to try me some of

Somebody's problem, somebody's goodbye
Somebody's last call number that they can't find
Somebody's best day, somebody's worst night
Somebody's reason for leavin' on the porch light
Thinkin' 'bout them tan lines and I'm thinkin' damn, I'd
Love to drown in them heartbreaker blue eyes
She's somebody's problem and somebody's problem's
About to be mine
About to be mine

Oh, hey baby, don't just keep me wishin'
Oh, let me get to fixin'

Somebody's problem, somebody's goodbye
Somebody's last call number that they can't find
Somebody's best day, somebody's worst night
Somebody's reason for leavin' on the porch light
Thinkin' 'bout them tan lines and I'm thinkin' damn, I'd
Love to drown in them heartbreaker blue eyes
She's somebody's problem and somebody's problem's
About to be mine
About to be mine
About to be mine
About to be mine"
Morgan Wallen,Still Goin Down by Morgan Wallen,"
The way I talk, I guess I got it from my pops
Product of some kneelin' down
In a town where the doors don't lock
And there's a million other people like me
From a scene a little more podunk than pop
I didn't choose being born in the sticks
And I'll be damned if I sound like something I ain't
For some folks, a backroad gets old
But for me, it just can't

'Cause I'm from a small town, southern drawl crowd
We're sippin' clear
, drinkin' beer on a Friday night
Every country girl got on her cutoffs
Shakin' her hips, take a trip, buddy tell me I'm a liar
Still circle up big trucks around a fire
Still kickin' up some dust behind the tires
Call it cliché, but hey, just take it from me
It's still goin' down out in the country

Somewhere now, someone's out there
Sippin' on some hundred proof
Every day, a baby's born with some
baby blues
A good ol' boy's got on his faded boots
Workin' a nine to five
I'm just another southern hell raiser
Ain't breakin' ground
Makin' sound for them drop-it-down tailgaters
But y'all, that's all I know to say
So if you think I'm full of it, ain't done it, check the resume

'Cause I'm from a small town, southern drawl crowd
We're sippin' clear, drinkin' beer on a Friday night
Every country girl got on her cutoffs
Shakin' her hips, take a trip, buddy tell me I'm a liar
Still circle up big trucks around a fire
Still kickin' up some dust behind the tires
Call it cliché, but hey, just take it from me
It's still goin' down out in the country

'Cause I'm from a small town, southern drawl crowd
We're sippin' clear, drinkin' beer on a Friday night
Every country girl got on her cutoffs
Shakin' her hips, take a trip, buddy tell me I'm a liar
Still circle up big trucks around a fire
Still kickin' up some dust behind the tires
Call it cliché, but hey, just take it from me
It's still goin' down out in the country"
Morgan Wallen,Up Down by Morgan Wallen (Ft. Florida Georgia Line),"
It's Friday after 5, got here just in time
Went ahead and wet a line 'fore I went and lost my mind
I ain't been here long, but the bobber's in the pond
Going up down, up, down, up, down
Tonight, we're gonna raise a whole lot more than cane
'Cause there's money in the bank and tomorrow's Saturday
So if they pass that fifth of Jack this way
I turn it up, down, up, down, up, down

We just holding it down here in BFE
Still rolling around with a burnt CD
Free Bird, five minutes deep
Head bobbing up, down, up, down, up, down
We got what we got, we don't need the rest
Can turn this parking lot into a party
With an ice chest, dancing, cold beer
Man, we live it up, down, up, down
We live it up down...here

What you know about it, T-Hubb?
What up, baby?

Yeah, the girls, they hit the spot, even hotter when it's hot
If you can't buy her a yacht, but still proud of what you got
'Cause when the day's done, red neck is from the sun
Going up, down, up, down, up, down

We just holding it down here in BFE
Still rolling around with a burnt CD
Free Bird, five minutes deep
Head bobbing up, down, up, down, up, down
We got what we got, we don't need the rest
Can turn this parking lot into a party
With an ice chest, dancing, cold beer
Man, we live it up, down, up, down
We live it up, down here

Somebody pass that fifth of Camp this way
I'll turn it up, down, up, down, up, down

We just holding it down here in BFE
Still rolling around with a burnt CD
Free Bird, five minutes deep
Head bobbing up, down, up, down, up, down
We got what we got, we don't need the rest
Can turn this parking lot into a party
With an ice chest, dancing, cold beer
Man, we live it up, down, up, down
We live it up, down here"
Morgan Wallen,Whiskey Glasses by Morgan Wallen,"
Poor me, pour me another drink
'Cause I don't wanna feel a thing
No more, hell nah
I just wanna sip 'til the pain wears off
Poor me, pour me another round
Line 'em up and knock 'em down
Two more let's go
'Cause I ain't never hurt like this before

Don't wanna think about her
Or wear a ring without her
Don't wanna hit the karaoke bar
Can't sing without her
So make them drinks strong
'Cause brother she's gone
And if I'm ever gonna move on

I'ma need some whiskey glasses
'Cause I don't wanna see the truth
She's probably making out on the couch right now
With someone new
Yeah, I'ma need some whiskey glasses
If I'm gonna make it through
If I'ma be single
I'ma need a double shot of that heartbreak proof
And see the world through whiskey glasses

And see the world through whiskey glasses


Last call
I swear this will be my last call
Now I ain't drunk dialing no more at 3 am
Mr. Bartender hittin' me again

Don't wanna think about her
Or wear a ring without her
Don't wanna hit the karaoke bar
Can't sing without her
So make them drinks strong
'Cause brother she's gone
And if I'm ever gonna move on
I'ma need some whiskey glasses
'Cause I don't wanna see the truth
She's probably making out on the couch right now
With someone new
Yeah, I'ma need some whiskey glasses
If I'm gonna make it through
If I'ma be single
I'ma need a double shot of that heartbreak proof
And see the world through whiskey glasses

Oh, see the world through whiskey glasses


Line 'em up, line 'em up, line 'em up, line 'em up
Knock 'em back, knock 'em back, knock 'em back, knock 'em back
Fill 'em up, fill 'em up, fill 'em up, fill 'em up
'Cause if she ain't ever coming back
Line 'em up, line 'em up, line 'em up, line 'em up
Knock 'em back, knock 'em back, knock 'em back, knock 'em back
Fill 'em up, fill 'em up, fill 'em up, fill 'em up
'Cause if she ain't ever coming back

I'ma need some whiskey glasses
'Cause I don't wanna see the truth
She's probably making out on the couch right now
With someone new
Yeah, I'ma need some whiskey glasses
If I'm gonna make it through
If I'ma be single
I'ma need a double shot of that heartbreak proof
And see the world through whiskey glasses

Oh, see the world through whiskey glasses

Yeah

And see the world through whiskey glasses

Yeah"
Morgan Wallen,Cover Me Up by Morgan Wallen,"
A heart on a run keeps a hand on a gun
Can't trust anyone
I was so sure what I needed was more
Tried to shoot out the sun
The days when we raged, we flew off the page
Such damage was done
But I made it through, 'cause somebody knew
I was meant for someone

So, girl, leave your boots by the bed, we ain't leavin' this room
'Til someone needs medical help or the magnolias bloom
It's cold in this house and I ain't goin' out to chop wood
So, cover me up and know you're enough to use me for good

I put your faith to the test when I tore off your dress
In Richmond on High
I sobered up, I swore off that stuff
Forever this time
And the old lover's sing, “I thought it'd be me
Who helped him get home”
But home was a dream, one that I'd never seen
'Til you came along

So, girl, hang your dress out to dry, we ain't leavin' this room
'Til Percy Priest breaks open wide and the river runs through
And carries this house on its Stones like a piece of driftwood
So, cover me up and know you're enough to use me for good


So, girl, leave your boots by the bed, we ain't leavin' this room
'Til someone needs medical help or the magnolias bloom
It's cold in this house and I ain't goin' out to chop wood
So, cover me up and know you're enough to use me for good

So, cover me up and know you're enough to use me for good"
Morgan Wallen,Wasted on You by Morgan Wallen,"
I don't always wake up in the mornin'
Pour myself a strong one
Aw, but when I get lonely I do
Your memory gets burnin'
Lean back on the bourbon
Sure as hell can't keep leanin' on you

Looks like I'm learnin' the hard way again
It's all my fault
Yeah, I dropped the ball
You're gone and I'm gone three sheets to the wind
Thinkin' 'bout all I've wasted on you

All of this time and all of this money
All of the these sorries I don't owe you honey
All of these miles on this Chevy, and prayers in a pew
All them days I spent, wasted on you
Wasted on you

Yeah, I swore this one'd be different
My heart wouldn't listen to my head and these boots on my feet
Looks like I'm learning the hard way again
That's why I've been wasted on you

All of this time and all of this money
All these sorries I don't owe you, honey
All of these miles on this Chevy and prayers in a pew
All them days I spent, wasted on you
Wasted on you

Like this pile of your stuff that's packed up in the back
Right down to the flame of this match
Wasted on you, wasted on you
Wasted on you, wasted on you
Wasted on you

All of this time and all of this money
All these sorries I don't owe you, honey
All of these miles on this Chevy and prayers in a pew
All them days I spent, wasted on you
Wasted on you
Wasted on you, wasted on you"
Morgan Wallen,The Way I Talk by Morgan Wallen,"
It's got a touch of the town where I grew up
Something in it them California girls love
Some people like to make a little fun of
The way I talk
It gets slower after three or four cold beers
And gets louder when I'm cheerin' on the Volunteers
Folks know I'm country, when they hear
The way I talk

It sounds a little bit like my daddy
It don't cuss around my mama
Got some words you've never heard
'Less you come from down yonder
The man upstairs
gets it
So I ain't tryna fix it
No, I can't hide it
I don't fight it, I just roll with it
Oh, kinda slow like the Mississippi roads
It's the only way I know
Man it ain't my fault
I just live the way I talk

Yeah it's, ""Yes sir, no ma'am, y'all come back, now""
Fightin' words if you run my last name down
I ain't ashamed, matter of fact I'm damn proud
Of the way I talk, y'all

It sounds a little bit like my daddy
It don't cuss around my mama
Got some words you've never heard
'Less you come from down yonder
The man upstairs gets it
So I ain't tryna fix it
No, I can't hide it
I don't fight it, I just roll with it
Oh, kinda slow like the Mississippi roads
It's the only way I know
Man it ain't my fault
I just live the way I talk

Slow, like a Sunday morning service back home
And kinda sweet when I got a girl to love on
If you know me, you know

It sounds a little bit like my daddy
It don't cuss around my mama
Got some words you've never heard
'Less you come from down yonder
The man upstairs gets it
So I ain't tryna fix it
No I can't hide it
I don't fight it, I just roll with it
Oh, kinda slow like the Mississippi roads
It's the only way I know
Man it ain't my fault
I just live the way I talk
The way I talk"
Morgan Wallen,Chasin' You by Morgan Wallen,"
We used to chase that Chattanooga freight
Couple of kids in a Chevrolet
Catch a little air when we cross the tracks
Sipping on something from a paper sack
You hang your shirt on that maple limb
Slipping through the moon to the river bend
Wasn't very long I was jumping in, jumping in
I guess I'm still doing now what I was doing then

Chasin' you like a shot of whiskey
Burning going down, burning going down
Chasin' you like those goodbye tail lights
Headed west to anywhere out of this nowhere town
Chasin' that freedom, chasing' that feeling that got gone too soon
Chasin' that you and me, I only see in my rearview
Yeah, I'm laying here tonight holding someone new
Still chasin' you, still chasin' you

You always used to talk about LA
I heard you got as far as Santa Fe
Well you know I tried to track you down
I only got as far as Guitar Town
Singing about
a girl I used to know, used to know
Well you should know that
I haven't given up
I'm just on your radio

Chasin' you like a shot of whiskey
Burning going down, burning going down
Chasin' you like those goodbye tail lights
Headed west to anywhere out of this nowhere town
Chasin' that freedom, chasin' that feeling that got gone too soon
Chasin' that you and me, I only see in my rearview
Yeah, I'm laying here tonight holding someone new
Still chasin' you, still chasin' you

Chasin' you like a shot of whiskey
Burning going down, burning going down
Chasin' you like those goodbye tail lights
Headed west to anywhere out of this nowhere town
Chasin' that freedom, chasin' that feeling that got gone too soon
Chasin' that you and me, I only see in my rearview
Yeah, I'm laying here tonight holding someone new
Still chasin' you, still chasin' you
Still chasin' you, still chasin' you"
Maddie & Tae,"Mama, I'm a Big Girl Now by Maddie Baillio (Ft. Andrea Martin, Ariana Grande, Dove Cameron, Harvey Fierstein & Kristin Chenoweth)","
Hey mama
, how do you get a red wine stain
Out of your favorite dress?
Black mascara off a pillowcase?
Cure a one-too-many headache?
Mama, can I come and maybe stay a few days
This weekend or next?
And hey, how do you get a red wine stain
Out of your favorite dress?

How does he sleep at night?
Mama, the nerve of this guy
To leave me so easy
Am I gonna be alright?
I wanna kick myself for falling so hard
Mama, can you die from a broken heart?

Can you ask Daddy if he's got time
To come and look at my front door?
It got slammed last night
And now it don't close right
And just promise that you won't tell him everything
And keep that pistol in the drawer
Mama, please don't say
I'm gonna laugh about this someday
You didn't see the way he drove away

How does he sleep at night?
Mama, the nerve of this guy
To leave me so easy
Am I gonna be alright?
I wanna kick myself for falling so hard
Mama, can you die from a broken heart?
Oh, a broken heart

Can your knees give out from prayin' so hard? 
Can you go blind from crying in the dark? 
Was it ever really real
If he don't feel like I feel?
How does he sleep at night?
Mama, the nerve of this guy
To leave me so easy
Am I gonna be alright?
How does he sleep at night?
Mama, the nerve of this guy
To leave me so easy
Am I gonna be alright?
I wanna kick myself for falling so hard
Mama, can you die from a broken heart?
A broken heart"
Maddie & Tae,Going Going Gone by Maddie Poppe,"
They don't cancel other plans
Have conversations with nothin' but their eyes
They don't hear each other's names and forget to concentrate
Hits a nerve and lights you up like dynamite

Friends don't call you in the middle of the night
Couldn't even tell you why
They just felt like saying, ""Hi""
Friends don't stand around, playing with their keys
Finding reasons not to leave
Tryna hide the chemistry
Drive a little too slow 
Take the long way home 
Get a little too close 
We do but, but friends don't

They don't almost say, ""I love you""
When they're downtown somewhere, just a little drunk
They don't talk about the future and put each other in it
And get chills with every accidental touch

Friends don't call you in the middle of the night
Couldn't even tell you why
They just felt like saying, ""Hi""
Friends don't stand around, playing with their keys
Finding reasons not to leave
Trying to hide the chemistry
Drive a little too slow 
Take the long way home 
Get a little too close 
We do but, but friends don't

I keep telling myself this might be nothing 
But one look in your eyes and, God, there's something 
You can lie to me and say you don't
But I know you do, and I love you too

Friends don't call you in the middle of the night
Couldn't even tell you why
They just felt like saying, ""Hi""
Friends don't stand around, playing with their keys
Finding reasons not to leave
Tryna hide the chemistry
Drive a little too slow 
Take the long way home 
Get a little too close 
We do but, but friends don't
Friends don't"
