artist_name,song_title,lyrics
Miranda Lambert,Mama's Broken Heart by Miranda Lambert,"
I cut my bangs with some rusty kitchen scissors
I screamed his name 'til the neighbors called the cops
I numbed the pain at the expense of my liver
Don’t know what I did next, all I know I couldn’t stop

Word got around to the barflies and the baptists
My mama’s phone started ringin' off the hook
I can hear her now, sayin' she ain’t gonna have it
Don’t matter how you feel, it only matters how you look

Go and fix your make up, girl, it’s just a break up
Run and hide your crazy and start actin’ like a lady
'Cause I raised you better, gotta keep it together
Even when you fall apart
But this ain’t my mama’s broken heart

Wish I could be just a little less dramatic
Like a Kennedy when Camelot went down in flames
Leave it to me to be holding the matches
When the fire trucks show up and there’s nobody else to blame

Can’t get revenge and keep a spotless reputation
Sometimes revenge's just a choice you gotta make
My mama came from a softer generation
Where you get a grip and bite your lip just to save a little face

Go and fix your make up, girl, it’s just a break up
Run and hide your crazy and start actin’ like a lady
'Cause I raised you better, gotta keep it together
Even when you fall apart
But this ain’t my mama’s broken heart

Powder your nose, paint your toes
Line your lips and keep 'em closed
Cross your legs, dot your eyes
And never let 'em see you cry

Go and fix your make up, girl, it’s just a break up
Run and hide your crazy and start actin’ like a lady
'Cause I raised you better, gotta keep it together
Even when you fall apart
But this ain’t my mama’s broken heart"
Miranda Lambert,Tin Man by Miranda Lambert,"
Hey there, Mr. Tin Man
You don't know how lucky you are
You shouldn't spend your whole life wishin'
For something bound to fall apart
Every time you're feeling empty
Better thank your lucky stars
If you ever felt one breaking
You'd never want a heart

Hey there, Mr. Tin Man
You don't know how lucky you are
I've been on the road that you're on
It didn't get me very far
You ain't missing nothing
'Cause love is so damn hard
Take it from me, darling
You don't want a heart

Hey there, Mr. Tin Man
I'm glad we talked this out
You can take mine if you want it
It's in pieces now
By the way there, Mr. Tin Man
If you don't mind the scars
You give me your armor
And you can have my heart"
Miranda Lambert,Vice by Miranda Lambert,"
Sting of the needle dropping on a vinyl
Neon singer with a jukebox title full of heartbreak
33, 45, 78
When it hurts this good you gotta play it twice
Another vice

All dressed up in a pretty black label
Sweet salvation on a dining room table
Waiting on me
Where the numb meets the lonely
It's gone before it ever melts the ice

Another vice, another call
Another bed I shouldn't crawl out of
At 7 AM with shoes in my hand
Said I wouldn't do it, but I did it again
And I know I'll be back tomorrow night, oh

I wear a town like a leather jacket
When the new wears off, I don't even pack it
If you need me
I'll be where my reputation don't precede me
Maybe I'm addicted to goodbyes

Another vice, another town
Where my past can't run me down
Another life, another call
Another bed I shouldn't crawl out of
At 7 AM with shoes in my hand
Said I wouldn't do it, but I did it again
And I know I'll be gone tomorrow night
Mm, another vice

Standing at the sink, not looking in the mirror
Don't know where I am or how I got here
Well, the only thing that I know how to find
Is another vice

Mm, another vice
Yes, another vice
Ooh, another vice
Another vice
Another vice
Another vice"
Miranda Lambert,Little Red Wagon by Miranda Lambert,"
You only love me for my big sunglasses
And my Tony Lamas
And my Dodge Dart Classic
You said ""I'll be Johnny and you'll be June
I'll ride with you to the moon""
But guess what?

You can't ride in my little red wagon
The front seat's broken and the axle's draggin'
You can't step to this backyard swagger
You know it ain't my fault when I'm walkin' jaws droppin' like
Ohhhh
Ahhhh
Ohhhh
Ahh

Oh, heaven help me
I been sowwin' wildflower seeds
And chasin' tumbleweeds
But that's just who I be
And you're just tryin' to slow this rolling stone
But I'm on to you babe
So guess what?

You can't ride in my little red wagon
The front seat's broken and the axle's draggin'
You can't step to this backyard swagger
You know it ain't my fault when I'm walkin' jaws droppin' like
Ohhhh
Ahhhh
Ohhhh
Ahh

Oh, you only love me for my big sunglasses and my Tony Lamas
I live in Oklahoma
And I've got long, blonde hair
And I play guitar and I go on the road
And I do all the shit you wanna do
And my dog does tricks
And I ain't about drama y'all
I love my apron
But I ain't your momma
So guess what?
What?!
You can't ride in my little red wagon
The front seat's broken and the axle's draggin'
You can't step to this backyard swagger
You know it ain't my fault when I'm walkin' jaws droppin' like
Ohhhh
Ahhhh
Ohhhh
Ahh"
Miranda Lambert,Somethin' Bad by Miranda Lambert (Ft. Carrie Underwood),"
Stand on the bar, stomp your feet, start clapping
Got a real good feeling somethin' bad about to happen

Pulled up to the church but I got so nervous
Had to back it on up, couldn't make it to the service
Grabbed all the cash underneath my mattress
Got a real good feeling somethin' bad about to happen

Ran into a girl in a pretty white dress
Rolled down a window
Where you headed to next?
Said I'm heading to the
bayou
with my money out of the mattress
Got a real good feeling somethin' bad about to happen

Stand on the bar, stomp your feet, start clapping
Got a real good feeling somethin' bad about to happen
Drinks keep coming, throw my head back laughing
Wake up in the morning, don't know what happened
Whoa... somethin' bad
Whoa... somethin' bad

Now me and that girl that I met on the street
We're rollin' down the road, down to New Orleans
Got a full tank of gas and the money out of the mattress
Got a real good feeling somethin' bad about to happen

Bout to tear it up down in New Orleans
Just like a real-life Thelma and Louise
If the cops catch up, they're gonna call it kidnapping
Got a real good feelin' somethin' bad about to happen

Stand on the bar, stomp your feet, start clapping
Got a real good feeling somethin' bad about to happen
Drinks keep coming, throw my head back laughing
Wake up in the morning, don't know what happened
Whoa... somethin' bad
Whoa... somethin' bad
Stand on the bar, stomp your feet, start clapping
Got a real good feeling somethin' bad about to happen
Drinks keep coming, throw my head back laughing
Wake up in the morning, don't know what happened

Whoa... somethin' bad
Whoa... somethin' bad"
Miranda Lambert,Bluebird by Miranda Lambert,"
Ooh
Ooh

Yeah,  I'm a turner
I turn pages all the time
Don't like where I'm at
34  was bad, so I just turn to 35
Yeah,  I'm a keeper
I keep digging down for the deep
Like  the records I'm playing
They might keep you waiting
But you know I'm only playing for keeps

And if the house just keeps on winning
I  got a wildcard up my sleeve
And if love keeps giving me lemons
I'll just mix 'em in my drink
And if the whole wide world stops singing
And all the stars go dark
I'll keep a light on in my soul
Keep a bluebird in my heart

Ooh
Ooh

Well, I'm a giver
Yeah, and I'm still giving 'em hell
Forgiving's pretty hard
So I made an art out of forgettin' 'em well
Yeah, I'm a rhymer
I can turn 20 cents into a 10
And if I get confused and I start to lose
I rhyme a dime 'til it all makes sense

And if the house just keeps on winning
I got a wildcard up my sleeve
And if love keeps giving me lemons
I'll just mix 'em in my drink
And if the whole wide world stops singing
And all the stars go dark
I turn a light on in my soul
And keep a bluebird in my heart

Ooh
Ooh
And if the house just keeps on winning
I got a wildcard up my sleeve
And if love starts giving me lemons
Just mix 'em in my drink
And if the whole wide world stops singing
And all the stars go dark
I'll keep a light on in my soul
Keep a bluebird in my heart
I'll keep a light on in my soul
Keep a bluebird in my heart
Keep a bluebird in my heart

Ooh
And the bluebird sings
Ooh"
Miranda Lambert,The House That Built Me by Miranda Lambert,"
I know they say, ""You can’t go home again""
I just had to come back one last time
Ma'am, I know you don't know me from Adam
But these hand prints on the front steps are mine
Up those stairs, in that little back bedroom
Is where I did my homework and I learned to play guitar
And I bet you didn't know under that live oak
My favorite dog is buried in the yard

I thought if I could touch this place or feel it
This brokenness inside me might start healing
Out here it’s like I'm someone else
I thought that maybe I could find myself
If I could just come in, I swear I'll leave
Won't take nothing but a memory
From the house that built me

Mama cut out pictures of houses for years
From 'Better Homes and Garden' magazine
Plans were drawn and concrete poured
Nail by nail and board by board
Daddy gave life to Mama's dream

I thought if I could touch this place or feel it
This brokenness inside me might start healing
Out here it’s like I'm someone else
I thought that maybe I could find myself
If I could just come in, I swear I'll leave
Won't take nothing but a memory
From the house that built me

You leave home, you move on and you do the best you can
I got lost in this whole world and forgot who I am

I thought if I could touch this place or feel it
This brokenness inside me might start healing
Out here it’s like I'm someone else
I thought that maybe I could find myself
If I could walk around, I swear I'll leave
Won't take nothing but a memory
From the house that built me"
Miranda Lambert,Over You by Miranda Lambert,"
Weather man said, it’s gonna snow
By now I should, be used to the cold

Mid-February shouldn’t be so scary
It was only December
I still remember the presents, the tree, you and me

But you went away
How dare you?
I miss you
They say I’ll be OK
But I’m not going to ever get over you

Living alone, here in this place
I think of you, and I’m not afraid

Your favorite records make me feel better
Cause you sing along
With every song
I know you didn’t mean to give them to me

But you went away
How dare you?
I miss you
They say I’ll be OK
But I’m not going to ever get over you

It really sinks in, you know, when I see it in stone

Cause you went away
How dare you?
I miss you
They say I’ll be OK
But I’m not going to ever get over you"
Miranda Lambert,Runnin' Just in Case by Miranda Lambert,"
There's trouble where I'm going
But I'm gonna go there anyway
I hate Sunday mornings
'Cause they always seem to start this way
I'm looking for a lighter
I already bought the cigarettes
Guess I picked me up a habit
On my way out of Lafayette
Eastbound and down
I turn it up 'cause that's sure how I feel
My mind is racing through the pines
My hands are shaky on the steering wheel
I'm going North on 59 but I know good and well
I'm headed South
'Cause me and Birmingham
Don't have a history of working out

What I lost in Louisiana
I found back in Alabama
But nobody ever taught me how to stay
It ain't love that I'm chasing
But I'm running just in case

I ain't unpacked my suitcase
Since the day that I turned twenty one
It's been a long ten years since then
It's getting kinda cumbersome
The first one and the last one
And the one that's got my name in ink
The smoker and the fighter
And the one in every song I sing

What I lost in Lubbock, Texas
I looked for in all the rest
But I guess no one ever taught me how to stay
It ain't love that I'm chasing
But I'm running just in case

I carry them around with me
I don't mind having scars
Happiness ain't prison
But there's freedom in a broken heart"
Miranda Lambert,Settling Down by Miranda Lambert,"
Should I give up sunsets for marigold mornings?
Should I look for rainbows or wait for the rain?
Is happiness on the highway? Or is it parked in the driveway?
Should I lean on you, babe? Or should you lean on me?

Am I looking for comfort? Am I looking for an escape?
Am I looking for you? Am I looking the other way?

I'm a wild child and a homing pigeon
Caravan and an empty kitchen
Bare feet on the tile with my head up in the clouds
One heart goin' both directions
One love and a couple of questions
Am I settlin' up or settlin' down?
Am I settlin' up or settlin' down?

I could plant a pretty garden or just send myself flowers
Be a jet-set Friday or a Sunday hometown girl
I could stay a little lonely or let you get to know me
Yeah, I could love a picket fence if it wrapped around the world

I'm a wild child and a homing pigeon
Caravan and an empty kitchen
Bare feet on the tile with my head up in the clouds
I'm one heart goin' both directions
One love and a couple of questions
Am I settlin' up or settlin' down?

Ooh, ooh, ooh

Am I looking for comfort? Am I looking for an escape?
Am I looking for you? Am I looking the other way?

I'm a wild child and a homing pigeon
A caravan and an empty kitchen
Bare feet on the tile with my head up in the clouds
One heart goin' both directions
One love and a couple of questions
Am I settlin' up or settlin' down? 
Am I settlin' up or settlin' down?
Ooh, ooh, ooh
Ooh, ooh, ooh"
Jon Pardi,Night Shift by Jon Pardi,"
It's been a wreck me week
Sixty plus from dawn to dusk
In the red dirt heat
Busting it up for a couple of bucks
But it ain't no thing
Just another day 'til I'm on my way
To them cool, cool sheets and you and me

Working on the night shift, baby
Dying for your touch like crazy
Racking up the overtime hours
Loving how we're working on the night shift, baby

Gonna rock it right
No need to talk, I know what you want
And what you like
'Cause I do too, yeah
I love how you leave on the lights
Not a thing between you and me
And it feels so nice when you and I are

Working on the night shift, baby
Dying for your touch like crazy
Racking up the overtime hours
Loving how we're working on the night shift, baby

Yeah, yeah
It's been a wreck me week
Oh, but who needs sleep?

When you're working on the night shift, baby
Dying for your touch like crazy
Racking up the overtime hours
Loving how we're working on the night shift, baby
Loving how we're working on the night shift
Loving how we're working on the night shift
Working on the night shift, baby"
Jon Pardi,Dirt On My Boots by Jon Pardi,"
Been up since the crack of dawn
Just trying to get paid
Been hotter than a hundred suns
I can't find no shade
Just two more rows and I'm good to go
Yeah, I'm shutting this tractor down
Give me a half an hour for a shave and a shower
And I'll be outside your house

Might have a little dirt on my boots
But I'm takin' you uptown tonight
Might have a little mud on my wheels
But they're gonna shine with you up inside
Gonna hit the club, gonna cut a rug
Burn it up like neon lights
Might have a little dirt on my boots
But we're gonna dance the dust right off them tonight, yeah girl
Got a little dirt on my boots

Hard as I worked all day
I'm gonna work harder loving on you
Spin you all over that dance floor
Right out of them high heel shoes
And when you're ready to quit
Baby, we can slip right out of that barroom door
And when I take you home, don't worry babe
I'm gonna kick them off on the porch

Might have a little dirt on my boots
But I'm taking you uptown tonight
Might have a little mud on my wheels
But they're gonna shine with you up inside
Gonna hit the club, gonna cut a rug
Burn it up like neon lights
Might have a little dirt on my boots
But we're gonna dance the dust right off them tonight, yeah girl
Got a little dirt on my boots

A little dirty dancing, blue collar romancing
I can get cleaned up if you ask me
But I can only get so fancy
Got a little dirt on my boots
But I'm taking you uptown tonight
Might have a little mud on my wheels
But they're gonna shine with you up inside
Gonna hit the club, gonna cut a rug
Burn it up like neon lights
Might have a little dirt on my boots
But we're gonna dance the dust right off them tonight, yeah girl
Got a little dirt on my boots
Got a little dirt on my boots
Got a little dirt on my boots"
Jon Pardi,Head Over Boots by Jon Pardi,"
I wanna sweep you off your feet tonight
I wanna love you and hold you tight
Spin you around on some old dance floor
Act like we never met before for fun

'Cause you're the one I want
You're the one I need
Baby, if I was a king
Ah, you would be my queen
You're the rock in my roll
You're good for my soul, it's true
I'm head over boots for you

The way you sparkle like a diamond ring
Maybe one day we can make it a thing
Test time and grow old together
Rock in our chairs and talk about the weather, yeah
So, bring it on in for that angel kiss
Put that feel good on my lips, cause

'Cause you're the one I want
You're the one I need
Baby, if I was a king
Ah, you would be my queen
You're the rock in my roll
You're good for my soul, it's true
I'm head over boots for you

Yeah, I'm here to pick you up
And I hope I don't let you down, no

'Cause you're the one I want
You're the one I need
Baby, if I was a king
Ah, you would be my queen
You're the rock in my roll
You're good for my soul, it's true
I'm head over boots for you

'Cause you're the one I want
You're the one I need
Baby, if I was a king
Ah, you would be my queen
You're the rock in my roll
You're good for my soul, it's true
I'm head over boots for you
I wanna sweep you off your feet tonight
I wanna love you and hold you tight
Spin you around on some old dance floor"
Jon Pardi,Heartache On The Dance Floor by Jon Pardi,"
Yeah, I was just hanging out
Some little west coast town
Found a bar out by the sand
So I made my way in
First thing that caught my eye
Lke nothing I'd ever seen
Sunburned auburn air
The California dream
Yeah, she was shaking them hips
To some old motown song
I couldn't say anything
So I sang along

She was a heartache on the dance floor
Yeah, she's moving through my mind
I gotta know her name and I gotta see her again
She's got me wondering, yeah I'm just wondering
Where she at, where she at, where she at tonight?
Where she at, where she at, where she at tonight?

So I just hung around
This little west coast town
I dropped by every night
I stayed till closing time
My little mystery
That girl is killing me
So I put on a song
Just to sing along

She was a heartache on the dance floor
Yeah, she's moving through my mind
I gotta know her name and I gotta see her again
She's got me wondering, yeah I'm just wondering
Where she at, where she at, where she at tonight?
Where she at, where she at, where she at tonight?
She's got me mesmerized, she's all I'm thinking about
All I think about, think about, think about

So I'm right here right now
Humming this little song
If I could say a thing
I'd want you to know
You were a heartache on the dance floor
Yeah, you're moving through my mind
I gotta know your name and I gotta see you again
And if you're listening, listening, listening
Where you at, where you at, where you at tonight?
Where you at, where you at, where you at tonight?
Girl, I'm hanging around this little town
Where you at, where you at, where you at tonight?
Where you at, where you at, where you at tonight?"
Jon Pardi,Heartache Medication by Jon Pardi,"
Same old dive, same old end of the work week drink
Bartender knows my name, but I don't mind
She kicks 'em up strong, serves me up right

And here I go again, I'm drinkin' one, I'm drinkin' two
I got my heartache medication, a strong dedication
To gettin' over you, turnin' me loose
On that hardwood jukebox lost in neon time
My heartache medication, well, it suits me fine
And I'm drinkin' enough to take you off my mind
I got my heartache medication

Another girl, another dance to a country song
Turnin' me on, here's to a good time
And halfway to feelin' alright

And here I go again, I'm drinkin' one, I'm drinkin' two
I got my heartache medication, a strong dedication
To gettin' over you, turnin' me loose
On that hardwood jukebox lost in neon time
My heartache medication, well it suits me fine
And I'm drinkin' enough to take you off my mind
I got my heartache medication

Single, drinkin' doubles
Teardrops turnin' into bubbles
Yeah, a little later on
I'll probably find me some trouble

And here I go again, I'm drinkin' one, I'm drinkin' two
I got my heartache medication, a strong dedication
To gettin' over you, turnin' me loose
On that hardwood jukebox lost in neon time
My heartache medication, well it suits me fine
And I'm drinkin' enough to take you off my mind
I got my heartache medication

Heartache medication takin' me away
Oh whoa"
Jon Pardi,She Ain't In It by Jon Pardi,"
Appreciate your call
Means a lot and all
Yeah, I got a minute
You and me can talk
About anything you want
As long as she ain't in it

Say, it's been at least a month
Since I've had any fun
Buddy, I'll admit it
Yeah, I'm into going out
Think I'm ready for a crowd
As long as she ain't in it

Don't wanna hear her name
I don't wanna see her face, I swear
I know its gonna hurt
If I run into her somewhere

We could hit that place
Down by the interstate
Out past the city limits
Hangout all night long
Hear a country song
As long as she ain't in it

Don't wanna hear her name
I don't wanna see her face, I swear
I know its gonna hurt
If I run into her somewhere

I can drink and I can dance
I can party, I can laugh
But no matter how you spin it
Everything has changed
My life won't be the same
As long as she ain't in it
As long as she ain't in it, no"
Jon Pardi,Ain’t Always the Cowboy by Jon Pardi,"
Her hands wrapped up in mine
Tears rollin' out of her eyes
No messin' with a made-up mind
Sun settin' on goodbye
Yeah, it's hard to believe
It wasn't me tryin' to leave this time

It ain't always the cowboy
That ain't got a lot of hang around
Ain't got no settle down in their boots
Gone's just what they do
That restless running, searchin' for something
Leavin' love in the dust of a midnight Chevrolet
It ain't always the cowboy that rides away

I've never seen over from this side
Never heard lonely get this quiet
Still, I can't keep from smiling
'Cause, damn, that girl can fly

It ain't always the cowboy
That ain't got a lot of hang around
Ain't got no settle down in their boots
Gone's just what they do
That restless running, searchin' for something
Leavin' love in the dust of a midnight Chevrolet
It ain't always the cowboy that rides away

A tumbleweed heart chasin' that wind
Goin' too far, wherever that is

It ain't always the cowboy
That ain't got a lot of hang around
Ain't got no settle down in their boots
Gone's just what they do
That restless running, searchin' for something
Leavin' love in the dust of a midnight Chevrolet
It ain't always the cowboy that rides away
Rides away
It ain't always the cowboy"
Jon Pardi,Can't Turn You Down by Jon Pardi,"
You're like a highway to a rebel that's ready to run
A no trespass sign on a barbwire jump
That I can't resist, that's just the way it is
You're a don't touch red button I want to push
A bad for me that feels so good
And we both know I can't say no

Cause a phone call turns into a what's up, what's up
Turns into ""baby, can you pick me up?""
Hey, I'm downtown and I don't wanna go home
After two left turns it's you and me alone
Turns into tangled up on my couch with you
Slipping your kisses right across my mouth
And that turns into later on
Later on, lights turned down
Cause I can't turn you down

I could say that I ain't picking up next time
I could say I don't want it, but I'd be lying
Cause baby the truth is I want you
And there ain't a damn thing I can do

A phone call turns into a what's up, what's up
Turns into ""baby, can you pick me up?""
Hey, I'm downtown and I don't wanna go home
After two left turns it's you and me alone
Turns into tangled up on my couch with you
Slipping your kisses right across my mouth
And that turns into later on
Later on, lights turned down
Cause I can't turn you down

You're like my favorite song
I can't turn you off

A phone call turns into a what's up, what's up
Turns into ""baby, can you pick me up?""
Hey, I'm downtown and I don't wanna go home
After two left turns it's you and me alone
Turns into tangled up on my couch with you
Slipping your kisses right across my mouth
And that turns into later on
Later on, lights turned down
Cause I can't turn you down
No, I can't turn you down
Can't turn you down"
