artist_name,song_title,lyrics
Morgan Wade,Reckless by Morgan Wade,"
Goin' too fast down the wrong way
Swimmin', and I pass where the waves break
I don't know where I'm goin' now
See no signs of slowin' down
Tryna make sense of this whole thing
Everybody runs from something, someday
I don't have a clue, who I am without you

Ooh-ooh, ooh-ooh
You had me thinkin' I was okay
Ooh-ooh, ooh-ooh
But then you turn around and left me

Reckless, no headlights
Driving too fast down shadow lines
Reckless, hand in the fire
No one to love, while I'm walking on the wire
Reckless, all alone
My heart is broken on the side of the road
I could fix it if I hеad home
You ain't here to drivе me
Reckless

You told me I should be more free
Is that how you tried to control me?
Did you ever really want this?
Were you afraid you were gonna miss?
I quit checkin' all the road signs
You don't give a damn what you left behind
I guess I'll be, moving on
'Til the thought of you is gone

Ooh-ooh, ooh-ooh
Gone like everything we've ever shared
Oh-oh, oh-oh
Like thinkin' you ever cared
And now I'm

Reckless, no headlights
Driving too fast down shadow lines
Reckless, hand in the fire
No one to love while, I'm walking on the wire
Reckless, all alone
My heart is broken on the side of the road
I could fix it if I head home
You ain't here to drive me
Reckless

Ooh-ooh, ooh-ooh
You had me thinkin' I was okay
Ooh-ooh, ooh-ooh
Then you turned around and made me

Reckless, no headlights
Driving too fast down shadow lines
Reckless, hand in the fire
No one to love while I'm walking on the wire
Reckless, all alone
My heart is broken on the side of the road
I could fix it if I head home
You ain't here to drive me
Reckless

You ain't here to drive me
Reckless"
Morgan Wade,Other Side by Morgan Wade,"
You knew my skin back before I had all these tattoos
You remember me on late nights strung out from pills and booze
We've had some bad times, baby, but we had some good times, too
You knew my skin back before I had all these tattoos

Baby, baby, baby
We ain't nothing but Rolling Stones
Being a gypsy ain't so bad when you're with me
'Cause I never have to be alone
You've seen the parts of me that the world says I should hide
But even in the dark you love my bitter heart
And we'll make it to the other side

These days when I look back, I just have to laugh
They all said that you and I would never last
I've made my share of mistakes and we left that in the past
These days when I look back, I just have to laugh

Baby, baby, baby
We ain't nothing but Rolling Stones
Being a gypsy ain't so bad when you're with me
'Cause I never have to be alone
You've seen the parts of me that the world says I should hide
But even in the dark you love my bitter heart
And we'll make it to the other side

But even in the dark
You love my bitter heart
And we'll make it to the other side

Baby, baby, baby
We ain't nothing but Rolling Stones
Being a gypsy ain't so bad when you're with me
'Cause I never have to be alone
You've seen the parts of me that the world says I should hide
But even in the dark you love my bitter heart
And we'll make it to the other side

Even in the dark
You love my bitter heart
And we'll make it to the other side
Even in the dark
You love my bitter heart
And we'll make it to the other side"
Morgan Wade,Last Cigarette by Morgan Wade,"Tell me the truth: Is it over for you?
It isn't for me, but I'll say what you want me to say
Addiction is strong, I know it's wrong
But I need that high, I ain't gonna lie
Give me tonight. So I can be alright
I can hold your body and you can hold mine
I want you one last time
Another hit to ease my mind
I don't want you to be over yet
Won't you be my last cigarette?
I thought it took three times
To burn into my mind
But, I had you once
And you threw a punch
But I'm not too mad
All the fun that we had
But it's hard to let go-
It's so hard to say no
I can't go all day
My hands, they shake
I've gone off the deep side
Habits gonna make me die
I want you one last time
Another hit to ease my mind
I don't want you to bе over yet
Won't you be my last cigarеtte?
So, you want better now
So, you gotta lay me down
But don't go, not yet
Wanna wake up with you on my breath
I want you one last time
Another hit to ease my mind
I don't want you to be over yet
Won't you be my last cigarette?"
Morgan Wade,Wilder Days by Morgan Wade,"
Hand in my hair and you said I looked pretty
You're so devious, rode in
From the Windy City
I ain't gotta clear view
Tell me what you want me to do and
Tell me every single secret in your mind
Come on, baby, we got nothing but time
You say, I'm too young for you
You're scared I'm too right for you

You said you hate the smell of cigarette smoke
You only used to smoke when you drank
When you lived in Chicago
Unsure where the wind blows
I wish I'd known you in your wilder days
And now here we go
You got me falling in love again
You gotta secret, I wanna keep it
I wish I'd known you in your wilder days

The way you move your hands across my body
Kissing you in a hotel lobby
Baby  I don't wanna lose this feeling
You're giving me something to believe in
And who were you before I knew your name?
Were you drunk at midnight waiting for the train?
You could have been anyone back then
Just another kid reaching for the wind

You said you hate the smell of cigarette smoke
You only use to smoke when you drank
When you lived in Chicago
Unsure where the wind blows
I wish I'd known you in your wilder days
And now here we go
You got me falling in love again
You gotta secret, I wanna keep it
I wish I'd known you in your wilder days

What were you like when you were a little wilder?
Why don't you show me?
Why don't you show me?
What you were like when you got a little higher?
Just for tonight, just for tonight
You said you hate the smell of cigarette smoke
You only use to smoke when you drank
When you lived in Chicago
Unsure where the wind blows
I wish I'd known you in your wilder days
And now here we go
You got me falling in love again
You gotta secret, I wanna keep it
I wish I'd known you in your wilder days
I wish I'd known you in your wilder days
I wish I'd known you in your wilder days"
Morgan Wade,Northern Air by Morgan Wade,"
Didn't know the difference between
What I needed and what I was wanting
And the way you looked at me
Was a little haunting
I can still see you with your whiskey and your ginger
Back of the bar, drunk in early September
But I'm missing you now
I'm still stuck here in this southern town

So tell me
Tell me, how's that northern air
And do you think of me when you're all alone?
Won't you bring yourself on home?

I sang you songs, I wrote about you, didn't even know it
Or maybe you did and you were too afraid to show it
Tonight I wonder if you're by yourself
But I can't imagine you with anyone else

So tell me
Tell me, how's that northern air
And do you think of me when you're all alone?
I could drive all night to be there
'Cause I don't think that I could stand
One more night on my own
Won't you bring yourself on home?

There's a red wine stain on my white dress
That I bought to impress you
That night that I confessed my truth
Didn't know it would upset you
I haven't seen you in so long
But after all this time, these feelings, they're not gone

So tell me
Tell me, how's that northern air
And do you think of me when you're all alone?
I could drive all night to be there
'Cause I don't think that I could stand
One more night on my own
Won't you bring yourself on home?
Won't you bring yourself on home?
Won't you bring yourself on home?
Won't you bring yourself on home?
There's a red wine stain on my white dress
That I bought to impress you"
Old Dominion,Written In the Sand by Old Dominion,"
Turn me on turn me off then you turn me back on by the weekend
And you won’t say the words that I want but you flirt when you’re drinkin’
I see those bubbles pop up like you’re texting then they disappear
Lets cut through the shit then let’s get to what we’re doing here

Are we just a backseat, tryna get it while we can
Are we names in a tattoo, or just a number on a hand
Are we last call kissing or will we be reminiscing with each other for the next forty years
Are we written in the stars, baby, or are we written in the sand

Yeah, I want you to want me to take you back home to my mama
Put my name on your lips call me yours and forget all this drama
Your makeup is next to my toothbrush but you never put it away on the shelf
I'm asking you baby 'cause i’m tired of asking myself

Are we just a backseat, tryna get it while we can
Are we names in a tattoo, or just a number on a hand
Are we last call kissing, are we dancing in the kitchen, baby tell me what it is or what it isn't
Are we written in the stars, baby, or are we written in the sand

Are we just a backseat, tryna get it while we can
Are we names in a tattoo, or just a number I should wash right off my hand
Are we last call kissing or will we be reminiscing with each other for the next forty years
Are we written in the stars baby, or are we written in the sand
Are we written in the stars baby, or are we written in the sand"
Old Dominion,No Such Thing as a Broken Heart by Old Dominion,"
Hey, hey
Keep your chin up
Hey, hey

I wonder if Jack and Diane ever made it
After the drums and the guitars all faded
Was the best they could do good enough?
Or did the heartland just swallow 'em up?
How did my mom and my dad ever do it?
If there was struggles, then we never knew it
I guess they had each other
That was enough

You know you can't keep the ground from shaking
No matter how hard you try
You can't keep the sunsets from fading
You gotta treat your life like you're jumping off a rope swing
Baby 'cause the whole thing's really just a shot in the dark
You gotta love like there's no such thing as a broken heart
You gotta love like there's no such thing as a broken heart

What am I gonna tell my kids when they see all of this bullshit that goes down on TV?
When the whole world is down on its luck
I gotta make sure they keep their chin up
Cry when it hurts, laugh when it's funny
Chase after the dream, don't chase after the money
And know we got each other
That's what's up

'Cause you can't keep the ground from shaking
No matter how hard you try
You can't keep the sunsets from fading
You gotta treat your life like you're jumping off a rope swing
Baby 'cause the whole thing's really just a shot in the dark
You gotta love like there's no such thing as a broken heart
You gotta love like there's no such thing as a broken heart

You gotta love like there's no such thing as a broken heart

'Cause you can't keep the ground from shaking
No matter how hard you try
You can't keep the sunsets from fading
You gotta treat your life like you're jumping off a rope swing
Baby 'cause the whole thing's really just a shot in the dark
You gotta love like there's no such thing as a broken heart
You gotta love, love, love, love, love 
You gotta love, love, love, love, love 
You gotta love like there's no such thing as a broken heart"
Old Dominion,Make It Sweet by Old Dominion,"
I know it's a drag, I know it's a grind
I know that a dollar ain't worth a dime
Just trying to keep up with the Joneses at the end of the block
I know you get tired, I know you get down
I know you get sick of this soul-sucking town
But let's make a little lemonade if lemons is all we got

'Cause I'm stuck on you, you're stuck on me
I never gotta wonder where my honey be
I ain't savin' all my sugar for a Saturday night
Seven days a week I got an appetite
The sunset's like a tangerine, let's find a road we've never seen
Don't waste another mile or a minute not kissin' me
Life is short, make it sweet

Open sky, glimpse of heaven, take the top off the CJ-7
Let that surfside San Anne wind mess up your hair
And let that windshield frame the ocean
Radio keep coast-to-coastin'
If we don't get where we're going baby I don't care
I'm already there

'Cause I'm stuck on you, you're stuck on me
I never gotta wonder where my honey be
I ain't savin' all my sugar for a Saturday night
Seven days a week I got an appetite
The sunset's like a tangerine, let's find a road we've never seen
Don't waste another mile or a minute not kissin' me
Life is short, make it sweet

Days will be long but the years will fly right by
We'll never be as young as we are tonight
Baby ain't that right, yeah

'Cause I'm stuck on you, you're stuck on me
I never gotta wonder where my honey be
I ain't savin' all my sugar for a Saturday night
Seven days a week I got an appetite
The sunset's like a tangerine, let's find a road we've never seen
Don't waste another mile or a minute not kissin' me
Life is short, make it sweet
Life is short, make it sweet
Oh yeah-yeah-yeah-yeah"
Old Dominion,Song for Another Time by Old Dominion,"
Right now we both know
We're Marina Del Ray
Planes gonna fly away
And you'll be on it
And by This Time Tomorrow
I'll be singing Yesterday
The sunshine's gonna fade
And we can't stop it
So before we turn in, I Can't Make You Love Me

Let's be
Brown Eyed Girl
,
Sweet Caroline
Freefallin'
Small Town Saturday Night
Before you lose that loving feeling
Let's go
Dancing on the Ceiling
Keep on living that
Teenage Dream
Paradise City
, where the grass is green
Pretty soon
I'll be so lonesome I could cry
But that's a song for another time

Just for
One More Day
,
What Do You Say?
Baby be my
Pretty Woman
Because we know
Sunday morning's coming down
Let's take a drive
, you and I
Down some old
country road
Talk about growing old in one of those
Pink Houses
Yeah we might be a
Candle in the Wind
But let's pretend we're

Brown Eyed Girl
sweet Caroline
Freefallin'
small town Saturday night
Before you lose that loving feeling
Let's go
dancing on the ceiling
Keep on living that
teenage dream
Paradise city
where the grass is green
Pretty soon you'll be
always on my mind
But that's a song for another time

So before we're singing
I will always love you

Let's sing
brown eyed girl
sweet Caroline
Freefallin'
small town Saturday night
Before you lose that loving feeling
Let's go
dancing on the ceiling
Keep on living that
teenage dream
Paradise city
where the grass is green
Pretty soon
I'll be so lonesome I could cry
But that's a song for another time
Yeah that's a song for another time

Yeah, that's a song for another time

That's a song for another time"
Old Dominion,One Man Band by Old Dominion,"
Been flyin' solo for so long
Nobody's singin' the harmony
Up there just me and my shadow
No bass, no guitar, no tambourine

And I found you like a melody
You were singin' in the same key as me
We had ‘em dancin' in the streets

I don't wanna be a one man band
I don't wanna be a rolling stone, alone
Puttin' miles on a run-down van
Baby, we can take our own show on the road
I'll lay down the beat, you'll carry the tune
We'll get tattoos, and we'll trash hotel rooms
Baby, take my hand
I don't wanna be a one man band
No

I wanna run down your wild dreams
And I wanna chase every high with you
Count every rip in these old jeans
We'll never learn how to sing the blues

If I'm gonna be famous
Girl, I wanna be famous with you
We got our own little groove

I don't wanna be a one man band
I don't wanna be a rolling stone, alone
Puttin' miles on a run-down van
Baby, we can take our own show on the road
I'll lay down the beat, you'll carry the tune
We'll get tattoos, and we'll trash hotel rooms
Baby, take my hand
'Cause I don't wanna be a one man band

When the spotlight goes cold, and the curtains come down
The chairs are all stacked, and there's no one around
And nobody's payin', we’ll still be playin'
I don't wanna be a one man band
I don't wanna be a rolling stone, alone
Puttin' miles on a run-down van
Baby, we can take our own show on the road
I'll lay down the beat, you'll carry the tune
We'll get tattoos, and we'll trash hotel rooms
Baby, take my hand
'Cause I don't wanna be a one man band
I don't wanna be a one man band"
Old Dominion,Hotel Key by Old Dominion,"
Well, it was down some street we couldn't even pronounce
We were smoking a little from a half an ounce
The tequila was cheap but the flow we were feeling was real
Neither one of us looking for three little words
Unless those three words were ""do not disturb""
Checkout was supposed to be noon but we slept in 'til three

She kept the hotel key
Slipped it in her purse
I guess, it makes her think of me
And that night we left our hearts on our sleeves and the clothes all over the floor
We both know we can't open the door no more
She kept the hotel key

Well, I could still see her on the bed sitting Indian style
With my t-shirt on and a half drunk smile
She talked about Austin and how she'd get back there someday
We had the curtains wide open and a song on my phone
We danced by the TV we never turned on
And wondered would anyone miss us if we ran away?
But this isn't one of those stories that ends up that way, no

She kept the hotel key
Slipped it in her purse
I guess, it makes her think of me
And that night we left our hearts on our sleeves and the clothes all over the floor
We both know we can't open the door no more
She kept the hotel key
Yeah

We left the lights
We left the crowd
We left the world and locked it out
She left a picture in my head
She left the night I can't forget, but

She kept the hotel key
Slipped it in her purse
I guess, it makes her think of me
And that night we left our hearts on our sleeves and the clothes all over the floor
We both know we can't open the door no more
She kept the hotel key
Yeah, she kept it
She kept the hotel key
Slipped it in her purse
I guess, it makes her think of me
And that night we left our hearts on our sleeves and the clothes all over the floor
We both know we can't open the door no more
She kept the hotel key
Yeah, she kept it
She kept the hotel key, ooh
She kept the hotel key"
Old Dominion,Snapback by Old Dominion,"
Strictly outta curiosity
What would happen if you got with me?
Kissin' you would hit the spot with me
Come on skip a couple rocks with me

Give me any of your heart tonight
Ain't no reason that we need to be apart tonight
I got something we can start tonight
Lookin' at you girl, it's hard to fight

Those stars need to be wished on
Your skin needs to be kissed on
My eyes baby, they're fixed on you
In your snapback
T-shirt of your favourite rock band
Checkin' your makeup in my Ray Bans
Breakin' hearts like only you can
In your snapback
Woah-oh-oh-oh
Woah-oh-oh-oh
Woah-oh-oh-oh
In your snapback

Come on baby, shoot a smile at me
Midnight selfie on a balcony
A little somethin' for my life screamin'
You're burnin' a hole in my pocket
And we've got the beat, let's drop it

Those stars need to be wished on
Your skin needs to be kissed on
My eyes baby, they're fixed on you
In your snapback
Tattoos, cut-offs, and converse
Singin' along to the song with the wrong words
Every move you make baby it works
In your snapback
Woah-oh-oh-oh
Woah-oh-oh-oh
Woah-oh-oh-oh
In your snapback

Those stars need to be wished on
Your skin needs to be kissed on
My eyes baby, they're fixed on you
In your snapback
T-shirt of your favourite rock band
Checkin' your makeup in my Ray Bans
Breakin' hearts like only you can
In your snapback
Woah-oh-oh-oh
Woah-oh-oh-oh
Woah-oh-oh-oh
In your snapback
Woah-oh-oh-oh
Woah-oh-oh-oh
Woah-oh-oh-oh
In your snapback
Woah-oh-oh-oh
Woah-oh-oh-oh
Woah-oh-oh-oh
In your snapback
Woah-oh-oh-oh
Woah-oh-oh-oh
Woah-oh-oh-oh
In your snapback"
Old Dominion,Break Up With Him by Old Dominion,"


Hey girl, wassup
I know it's late but I knew you'd pick it up
Naw, I ain't drunk
Okay, maybe I do have a little buzz, but
That song came on and I just thought
What harm could come from one little call
I know you say you're taken but I say
Girl you're takin' too long

To tell him that it's over
Then bring it on over
Stringing him along any longer girl
Is just wasting precious time
Girl you know it can't wait
Rip it off just like a Band-Aid
The way you look at me, girl, you can't pretend
I know you ain't in love with him
Break up with him

I know you don't wanna break his heart
But that ain't no good reason to be
Keeping us apart
Look, just tell him it's you, it ain't him
And maybe you can lie to him and say you'll
Still be friends
Whatever you got to say to get through to him
That you ain't in love
C'mon you can't deny that you and I
Kinda fit like a glove

So tell him that it's over
Then bring it on over
Stringing him along any longer girl
Is just wasting precious time
Girl you know it can't wait
Rip it off just like a Band-Aid
It ain't my business to be all up in
But I know you ain't in love with him
Break up with him
I know that you so done with him
Break up with him, break up with him

You would've hung up by now
If you weren't thinking it too
No pressure whatever
Just do what you gotta do
But if I was you
I'd tell him that it's over
Then bring it on over
Stringing him along any longer girl
Is just wasting precious time
Girl you know it can't wait
Just rip it off just like a Band-Aid
Yeah, I know I said it but I'll say it again
I know you ain't in love with him
Break up with him
The way you look at me girl you can't pretend
I know you ain't in love with him
Break up with him
Just break up with him"
Old Dominion,A Girl Is a Gun by Old Dominion,"
Seems innocent enough when your buying the drinks at the bar and you're both getting loaded
Don't even know just the danger you're in cause you're so caught up in the moment
But you shoot a smile cuts through the smoke
Hits you before you even know

A girl is a gun
She's harder to handle than you think son
You feel safe when you're with her
Think twice before you pull the trigger
She feels good in your hand from the first little spark
But guns shoot bullets and bullets break hearts
Heartbreak's a bitch
She'll kill you with a kiss
So before careful when you're holding one
Cause a girl is a gun

She's cold and she's hot
She's fun but she's not some play thing two dollar pistol
Say the right thing she'll go off with a bang
But be careful cause she kicks a little
Hold her just right don't let her down
You're gonna get hurt if you mess around

A girl is a gun
She's harder to handle than you think son
You feel safe when you're with her
Think twice before you pull the trigger
She feels good in your hand from the first little spark
But guns shoot bullets and bullets break hearts
Heartbreak's a bitch
She'll kill you with a kiss
So before careful when you're holding one
Cause a girl is a gun

Yeah a girl is a gun
She's harder to handle than you think son
You feel safe when you're with her
Think twice before you pull the trigger
She feels good in your hand from the first little spark
But guns shoot bullets and bullets break hearts
Heartbreak's a bitch
She'll kill you with a kiss
So before careful when you're holding one
Cause a girl is a gun
Yeah a girl is a gun"
Old Dominion,Shoe Shopping by Old Dominion,"
Some don't last the way they should
Some make you feel good for a little while
And then you throw 'em away
Some are up on a shelf for some other time
Some are high dollar, some ain't worth a dime
But you keep 'em anyway

Everybody's looking for something
So how do I catch your eye, eye, eye

If you're shoe shopping walk a mile with me
Slip a Cinderella slipper right on your feet
Take my arm, strut down the street tonight

If you're downtown on the browse about
Looking for the perfect fit, how's about
Some high-heel, high-top, pump 'em up, flip-flop
Heads-up, lucky penny loafer on a sidewalk
Patent leather, blue suede, tailor made, whatever you like
If you're shoe shopping, try me on for size

You're stepping on cracks, you're breaking your back
You're working so damn hard just to make it look easy
Come dance with me 'cause dancing's free
Let me sweep you right off your feet
Whatever your style is, girl, that's what mine is
I could go good with your eyes

If you're shoe shopping walk a mile with me
Slip a Cinderella slipper right on your feet
Take my arm, strut down the street tonight

If you're downtown on the browse about
Looking for the perfect fit, how's about
Some high-heel, high-top, pump 'em up, flip-flop
Heads-up, lucky penny loafer on a sidewalk
Patent leather, blue suede, tailor made, whatever you like
If you're shoe shopping, try me on for size

Yeah, everybody's looking for something
So how do I catch your eye, eye, eye

If you're shoe shopping walk a mile with me
Slip a Cinderella slipper right on your feet
Take my arm, strut down the street tonight

If you're downtown on the browse about
Looking for the perfect fit, how's about
Some high-heel, high-top, pump 'em up, flip-flop
Heads-up, lucky penny loafer on a sidewalk
Patent leather, blue suede, tailor made, whatever you like
If you're shoe shopping, try me on for size
Try me on for size
Try me on for size
Never know unless you try"
